{"$schema":"https://json-schema.org/draft/2020-12/schema","$id":"https://github.com/f2re/synopsis_game/training/lora/characters/manifest.schema.json","title":"26063 characters LoRA generation manifest","type":"object","additionalProperties":false,"required":["schema_version","dataset","adapter","trigger","target_render","generation_contract","enums","style_contract","prompt_prefix","negative_prompt","identities","samples"],"properties":{"schema_version":{"const":1},"dataset":{"const":"synopsis_pixel_char"},"adapter":{"const":"characters"},"trigger":{"const":"synopsis_pixel_char"},"target_render":{"type":"object","additionalProperties":false,"required":["min_long_edge","scaling"],"properties":{"min_long_edge":{"type":"integer","minimum":1024},"scaling":{"const":"native_or_integer_nearest"}}},"generation_contract":{"type":"object","additionalProperties":false,"required":["images_per_job","collage","allow_flip","allow_recolour_clone","allow_smooth_upscale","no_text","no_ui","background"],"properties":{"images_per_job":{"const":1},"collage":{"const":false},"allow_flip":{"const":false},"allow_recolour_clone":{"const":false},"allow_smooth_upscale":{"const":false},"no_text":{"const":true},"no_ui":{"const":true},"background":{"const":"neutral_light_gray"}}},"enums":{"type":"object"},"style_contract":{"type":"object"},"prompt_prefix":{"type":"string","minLength":100},"negative_prompt":{"type":"string","minLength":30},"identities":{"type":"object","minProperties":20,"additionalProperties":{"type":"string","minLength":20}},"samples":{"type":"array","minItems":30,"maxItems":30,"items":{"type":"object","additionalProperties":false,"required":["id","subject_id","subject_kind","lineage_id","split","render_type","pose","view","background","independent_render","num_images","min_long_edge","output_path"],"properties":{"id":{"type":"string","pattern":"^char-[a-z0-9-]+-[0-9]{2}$"},"subject_id":{"type":"string","minLength":1},"subject_kind":{"enum":["human","fauna"]},"lineage_id":{"type":"string","pattern":"^char-src-[0-9]{3}$"},"split":{"enum":["train","validation"]},"render_type":{"const":"character_reference"},"pose":{"type":"string","minLength":1},"view":{"enum":["near_front","three_quarter_left","three_quarter_right","profile_left","profile_right"]},"background":{"const":"neutral_light_gray"},"independent_render":{"const":true},"num_images":{"const":1},"min_long_edge":{"type":"integer","minimum":1024},"output_path":{"type":"string","pattern":"^datasets/lora/characters/source/.+\\.png$"}}}}}}
