{"schema_version":1,"dataset":"synopsis_pixel_char","adapter":"characters","trigger":"synopsis_pixel_char","target_render":{"min_long_edge":1024,"scaling":"native_or_integer_nearest"},"generation_contract":{"images_per_job":1,"collage":false,"allow_flip":false,"allow_recolour_clone":false,"allow_smooth_upscale":false,"no_text":true,"no_ui":true,"background":"neutral_light_gray"},"enums":{"subject_kind":["human","fauna"],"render_type":["character_reference"],"view":["near_front","three_quarter_left","three_quarter_right","profile_left","profile_right"],"background":["neutral_light_gray"],"split":["train","validation"]},"style_contract":{"pixel_scale":"fixed_logical_pixel_size","presentation":"nearest_neighbour","local_surface_shades":[3,5],"silhouette":"clear_readable_single_subject","forbidden":["mixed pixel scales","smooth antialiasing","painterly gradients","navy or purple studio background","collage or contact sheet","mirrored opposite-side substitute","named-game imitation"]},"prompt_prefix":"Standalone single character reference image, exactly one subject unless subject_kind=fauna and the subject is explicitly a flock. No frame, no text, no logo, no user interface, no collage, no contact sheet. Original 26063 cozy scientific pixel-art character language. Use one consistent logical pixel size across the entire image, hard square pixel clusters, nearest-neighbour appearance, no anti-aliasing, no smooth gradients, no mixed pixel scales and no random one-pixel noise. Keep a clean readable silhouette and three to five shades per local material. Full subject must fit comfortably inside the image with stable margins. Use a neutral light-gray background; do not use dark navy, purple or decorative studio scenery. Do not imitate or name any commercial game style.","negative_prompt":"collage, contact sheet, split screen, text, caption, logo, HUD, UI panel, dark navy studio background, purple studio background, smooth vector edge, anti-aliasing, mixed pixel sizes, blur, random one-pixel noise, painterly gradient, photorealism, 3D render, mirrored duplicate, duplicated limbs, extra subjects, named-game imitation","identities":{"hero":"young male meteorology trainee, brown hair, blue hoodie, practical backpack; keep the same face, hair, hoodie and backpack identity across all references","heroine":"young female meteorology trainee, practical weatherproof campus clothing, compact backpack; keep the same face, hair and clothing identity across all references","vera_ladozhskaya":"Vera Pavlovna Ladozhskaya, 58, intelligent calm face, thin metal-frame glasses, neat greying dark-blond hair in a bun, dark navy or lingonberry knitted cardigan over a light blouse, two-colour red-blue pencil or folded map","semyon_kruglov":"Semyon Petrovich Kruglov, 51, senior meteorological instrument technician, practical weathered face, knitted cap, dark olive and mustard work windbreaker over a warm high-neck sweater, canvas instrument bag","georgy_korf":"Georgy Ilyich Korf, 62, tall lean aerology head, grey beard, dark-blue insulated vest over a checked shirt, tablet or radiosonde component","kira_vyazemskaya":"Kira Andreevna Vyazemskaya, 46, archive and climatology specialist, composed intelligent expression, practical dark cardigan or vest over a modest blouse, archive folder or bound climatology volume","pavel_morozov":"Pavel Morozov, 34, radar and satellite engineer, sea-green fleece, communications headset, lightly tinted glasses, compact technical tablet","polina_sinitsyna":"Polina Sinitsyna, 24, junior synoptician and night-shift observer, practical layered campus clothing, neat hair, notebook or weather log, alert professional expression","artem_volkov":"Artem Volkov, 22, trainee from a parallel group, youthful competitive expression, practical trainee jacket, notebook or backpack, no flashy fashion styling","trainee_a":"secondary meteorology trainee archetype A, young adult, practical campus field jacket, notebook, stable identity","trainee_b":"secondary meteorology trainee archetype B, young adult, practical sweater and light field vest, pencil case, stable identity","trainee_c":"secondary meteorology trainee archetype C, young adult, practical rain shell and backpack, stable identity","pascal_cat":"Gectopascal (Pascal), plump fluffy ginger-white cat, saturated ginger back and tail, white chest muzzle and paws, pink nose, green eyes, small visible notch at the tip of the left ear","corgi_blue_bandana":"friendly corgi, compact body, warm tan-and-white coat, blue bandana, stable markings","great_tit":"great tit bird, black head and throat, white cheeks, yellow breast, olive back, realistic northwestern urban bird proportions","gull":"Baltic urban gull, grey-white plumage, yellow bill, realistic compact coastal bird proportions","mallard":"mallard duck, realistic compact proportions and canonical plumage, calm standing pose","pigeon":"urban rock pigeon, blue-grey plumage with darker wing bars, compact realistic city-bird proportions","bullfinch":"bullfinch, compact body, black cap, grey back and red-orange breast, realistic northwestern winter bird proportions","bird_flock":"small mixed-distance flock of northwestern urban and coastal birds, readable silhouettes, no duplicated stamp-like birds"},"samples":[{"id":"char-hero-01","subject_id":"hero","subject_kind":"human","lineage_id":"char-src-001","split":"train","render_type":"character_reference","pose":"standing_neutral","view":"near_front","background":"neutral_light_gray","independent_render":true,"num_images":1,"min_long_edge":1024,"output_path":"datasets/lora/characters/source/char-hero-01.png"},{"id":"char-hero-02","subject_id":"hero","subject_kind":"human","lineage_id":"char-src-002","split":"train","render_type":"character_reference","pose":"walking","view":"three_quarter_left","background":"neutral_light_gray","independent_render":true,"num_images":1,"min_long_edge":1024,"output_path":"datasets/lora/characters/source/char-hero-02.png"},{"id":"char-hero-03","subject_id":"hero","subject_kind":"human","lineage_id":"char-src-003","split":"train","render_type":"character_reference","pose":"pointing","view":"three_quarter_right","background":"neutral_light_gray","independent_render":true,"num_images":1,"min_long_edge":1024,"output_path":"datasets/lora/characters/source/char-hero-03.png"},{"id":"char-hero-04","subject_id":"hero","subject_kind":"human","lineage_id":"char-src-004","split":"train","render_type":"character_reference","pose":"cheering","view":"near_front","background":"neutral_light_gray","independent_render":true,"num_images":1,"min_long_edge":1024,"output_path":"datasets/lora/characters/source/char-hero-04.png"},{"id":"char-hero-05","subject_id":"hero","subject_kind":"human","lineage_id":"char-src-005","split":"validation","render_type":"character_reference","pose":"thinking","view":"profile_left","background":"neutral_light_gray","independent_render":true,"num_images":1,"min_long_edge":1024,"output_path":"datasets/lora/characters/source/char-hero-05.png"},{"id":"char-heroine-01","subject_id":"heroine","subject_kind":"human","lineage_id":"char-src-006","split":"train","render_type":"character_reference","pose":"standing_neutral","view":"three_quarter_left","background":"neutral_light_gray","independent_render":true,"num_images":1,"min_long_edge":1024,"output_path":"datasets/lora/characters/source/char-heroine-01.png"},{"id":"char-heroine-02","subject_id":"heroine","subject_kind":"human","lineage_id":"char-src-007","split":"train","render_type":"character_reference","pose":"walking","view":"three_quarter_right","background":"neutral_light_gray","independent_render":true,"num_images":1,"min_long_edge":1024,"output_path":"datasets/lora/characters/source/char-heroine-02.png"},{"id":"char-heroine-03","subject_id":"heroine","subject_kind":"human","lineage_id":"char-src-008","split":"validation","render_type":"character_reference","pose":"thinking","view":"profile_right","background":"neutral_light_gray","independent_render":true,"num_images":1,"min_long_edge":1024,"output_path":"datasets/lora/characters/source/char-heroine-03.png"},{"id":"char-vera-ladozhskaya-01","subject_id":"vera_ladozhskaya","subject_kind":"human","lineage_id":"char-src-009","split":"train","render_type":"character_reference","pose":"holding_two_colour_pencil","view":"three_quarter_left","background":"neutral_light_gray","independent_render":true,"num_images":1,"min_long_edge":1024,"output_path":"datasets/lora/characters/source/char-vera-ladozhskaya-01.png"},{"id":"char-vera-ladozhskaya-02","subject_id":"vera_ladozhskaya","subject_kind":"human","lineage_id":"char-src-010","split":"validation","render_type":"character_reference","pose":"reviewing_folded_map","view":"profile_right","background":"neutral_light_gray","independent_render":true,"num_images":1,"min_long_edge":1024,"output_path":"datasets/lora/characters/source/char-vera-ladozhskaya-02.png"},{"id":"char-semyon-kruglov-01","subject_id":"semyon_kruglov","subject_kind":"human","lineage_id":"char-src-011","split":"train","render_type":"character_reference","pose":"carrying_instrument_bag","view":"three_quarter_right","background":"neutral_light_gray","independent_render":true,"num_images":1,"min_long_edge":1024,"output_path":"datasets/lora/characters/source/char-semyon-kruglov-01.png"},{"id":"char-semyon-kruglov-02","subject_id":"semyon_kruglov","subject_kind":"human","lineage_id":"char-src-012","split":"validation","render_type":"character_reference","pose":"checking_small_instrument","view":"three_quarter_left","background":"neutral_light_gray","independent_render":true,"num_images":1,"min_long_edge":1024,"output_path":"datasets/lora/characters/source/char-semyon-kruglov-02.png"},{"id":"char-georgy-korf-01","subject_id":"georgy_korf","subject_kind":"human","lineage_id":"char-src-013","split":"train","render_type":"character_reference","pose":"holding_radiosonde_component","view":"three_quarter_left","background":"neutral_light_gray","independen